Sketch: C:\Users\鉄朗\Google ドライブ\大学\講義資料\２０１４年度前期\情報表現\進捗、どうですか？\tm_1014167, 2014-07-17 01:16:15.068
Comma in error msg is substituted with ^ symbol
For separating arguments in error args | symbol is used
ERROR TYPE, ERROR ARGS, ERROR MSG
UndefinedType,{ControlEvent},ControlEvent cannot be resolved to a type
UndefinedType,{ControlP5},ControlP5 cannot be resolved to a type
MethodVarargsArgumentNeedCast,{java.lang.String[]| java.lang.Object[]| println| java.lang.Object...| processing.core.PApplet| java.lang.Object},The argument of type String[] should explicitly be cast to Object[] for the invocation of the varargs method println(Object...) from type PApplet. It could alternatively be cast to Object for a varargs invocation
UndefinedName,{cp5},cp5 cannot be resolved
UnresolvedVariable,{cp5},cp5 cannot be resolved to a variable
